{
  "schemaVersion": "mana.story-start.discovery-inventory/v2",
  "artifactVersion": 2,
  "artifactId": "discovery_ffffffffffffffffffffffffffffffffffffffffffffffffffffffffffffffff",
  "storyId": "story-synthetic-alert-001",
  "acceptanceCriteria": [
    {"id":"ac_cccccccccccccccccccccccccccccccccccccccccccccccccccccccccccccccc","sourceKey":"AC-03","text":"A retried notification must not create a duplicate ledger annotation.","approvalStatus":"pending","provenanceRefs":["provenance_aaaaaaaaaaaaaaaaaaaaaaaaaaaaaaaaaaaaaaaaaaaaaaaaaaaaaaaaaaaaaaaa"]},
    {"id":"ac_aaaaaaaaaaaaaaaaaaaaaaaaaaaaaaaaaaaaaaaaaaaaaaaaaaaaaaaaaaaaaaaa","sourceKey":"AC-01","text":"After a ledger entry is committed, an eligible account receives one settlement notification.","approvalStatus":"approved","provenanceRefs":["provenance_aaaaaaaaaaaaaaaaaaaaaaaaaaaaaaaaaaaaaaaaaaaaaaaaaaaaaaaaaaaaaaaa"]},
    {"id":"ac_bbbbbbbbbbbbbbbbbbbbbbbbbbbbbbbbbbbbbbbbbbbbbbbbbbbbbbbbbbbbbbbb","sourceKey":"AC-02","text":"An authenticated user can view the notification result regardless of sign-in path.","approvalStatus":"ambiguous","provenanceRefs":["provenance_aaaaaaaaaaaaaaaaaaaaaaaaaaaaaaaaaaaaaaaaaaaaaaaaaaaaaaaaaaaaaaaa"]}
  ],
  "mandatoryConstraints": [
    {"id":"constraint_aaaaaaaaaaaaaaaaaaaaaaaaaaaaaaaaaaaaaaaaaaaaaaaaaaaaaaaaaaaaaaaa","kind":"authorization","statement":"The observed account lookup must preserve the supplied authenticated principal boundary.","evidenceRefs":["ev_1111111111111111111111111111111111111111111111111111111111111111"]}
  ],
  "evidence": [
    {"id":"ev_aaaaaaaaaaaaaaaaaaaaaaaaaaaaaaaaaaaaaaaaaaaaaaaaaaaaaaaaaaaaaaaa","kind":"configuration","epistemicStatus":"observed","summary":"Synthetic notifier configuration already contains the settlement channel entry.","capabilityState":"already_exists","preExistingStatus":"yes","provenanceRefs":["provenance_cccccccccccccccccccccccccccccccccccccccccccccccccccccccccccccccc"]},
    {"id":"ev_bbbbbbbbbbbbbbbbbbbbbbbbbbbbbbbbbbbbbbbbbbbbbbbbbbbbbbbbbbbbbbbb","kind":"branch","epistemicStatus":"observed","summary":"Synthetic implementation branch is behind its declared baseline and requires alignment evidence before planning is trusted.","capabilityState":"unknown","preExistingStatus":"unknown","provenanceRefs":["provenance_bbbbbbbbbbbbbbbbbbbbbbbbbbbbbbbbbbbbbbbbbbbbbbbbbbbbbbbbbbbbbbbb"]},
    {"id":"ev_cccccccccccccccccccccccccccccccccccccccccccccccccccccccccccccccc","kind":"repository","epistemicStatus":"observed","summary":"A synthetic unrelated legacy defect predates this story and has no linked acceptance criterion.","capabilityState":"requires_change","preExistingStatus":"yes","provenanceRefs":["provenance_dddddddddddddddddddddddddddddddddddddddddddddddddddddddddddddddd"]},
    {"id":"ev_dddddddddddddddddddddddddddddddddddddddddddddddddddddddddddddddd","kind":"repository","epistemicStatus":"reported","summary":"Direct and federated synthetic sign-in paths expose different account identifiers for the AC-02 behavior.","capabilityState":"unknown","preExistingStatus":"unknown","provenanceRefs":["provenance_dddddddddddddddddddddddddddddddddddddddddddddddddddddddddddddddd"]},
    {"id":"ev_eeeeeeeeeeeeeeeeeeeeeeeeeeeeeeeeeeeeeeeeeeeeeeeeeeeeeeeeeeeeeeee","kind":"service_context","epistemicStatus":"reported","summary":"The supplied context documents best-effort and durable-recovery delivery alternatives after commit.","capabilityState":"unknown","preExistingStatus":"unknown","provenanceRefs":["provenance_eeeeeeeeeeeeeeeeeeeeeeeeeeeeeeeeeeeeeeeeeeeeeeeeeeeeeeeeeeeeeeee"]},
    {"id":"ev_ffffffffffffffffffffffffffffffffffffffffffffffffffffffffffffffff","kind":"human_decision","epistemicStatus":"reported","summary":"Synthetic business approval for delivery guarantees remains pending with the Product Owner.","capabilityState":"unknown","preExistingStatus":"unknown","provenanceRefs":["provenance_aaaaaaaaaaaaaaaaaaaaaaaaaaaaaaaaaaaaaaaaaaaaaaaaaaaaaaaaaaaaaaaa"]},
    {"id":"ev_0000000000000000000000000000000000000000000000000000000000000000","kind":"repository","epistemicStatus":"observed","summary":"Two synthetic legacy readers disagree about whether a null enabled flag is true or false.","capabilityState":"unknown","preExistingStatus":"yes","provenanceRefs":["provenance_dddddddddddddddddddddddddddddddddddddddddddddddddddddddddddddddd"]},
    {"id":"ev_1111111111111111111111111111111111111111111111111111111111111111","kind":"repository","epistemicStatus":"observed","summary":"Synthetic account lookup has an authorization boundary relevant to the observed identity ambiguity.","capabilityState":"not_applicable","preExistingStatus":"unknown","provenanceRefs":["provenance_dddddddddddddddddddddddddddddddddddddddddddddddddddddddddddddddd"]}
  ],
  "findings": [
    {"id":"finding_aaaaaaaaaaaaaaaaaaaaaaaaaaaaaaaaaaaaaaaaaaaaaaaaaaaaaaaaaaaaaaaa","findingKind":"existing_configuration","summary":"Existing synthetic configuration is a verified fact; discovery does not request adding configuration.","evidenceRefs":["ev_aaaaaaaaaaaaaaaaaaaaaaaaaaaaaaaaaaaaaaaaaaaaaaaaaaaaaaaaaaaaaaaa"],"acceptanceCriterionRefs":["ac_aaaaaaaaaaaaaaaaaaaaaaaaaaaaaaaaaaaaaaaaaaaaaaaaaaaaaaaaaaaaaaaa"],"mandatoryConstraintRefs":[],"decisionRefs":[],"storyCausality":"not_applicable","suggestedOwner":null},
    {"id":"finding_bbbbbbbbbbbbbbbbbbbbbbbbbbbbbbbbbbbbbbbbbbbbbbbbbbbbbbbbbbbbbbbb","findingKind":"readiness","summary":"Branch alignment is repository/readiness evidence, not developer effort.","evidenceRefs":["ev_bbbbbbbbbbbbbbbbbbbbbbbbbbbbbbbbbbbbbbbbbbbbbbbbbbbbbbbbbbbbbbbb"],"acceptanceCriterionRefs":[],"mandatoryConstraintRefs":[],"decisionRefs":[],"storyCausality":"unknown","suggestedOwner":"release-owner"},
    {"id":"finding_cccccccccccccccccccccccccccccccccccccccccccccccccccccccccccccccc","findingKind":"defect","summary":"The observed independent legacy defect is pre-existing and not assigned to the current story.","evidenceRefs":["ev_cccccccccccccccccccccccccccccccccccccccccccccccccccccccccccccccc"],"acceptanceCriterionRefs":[],"mandatoryConstraintRefs":[],"decisionRefs":[],"storyCausality":"pre_existing_independent","suggestedOwner":"legacy-owner"},
    {"id":"finding_dddddddddddddddddddddddddddddddddddddddddddddddddddddddddddddddd","findingKind":"ambiguity","summary":"Direct/SSO identity behavior is ambiguous for AC-02; no identity strategy is selected.","evidenceRefs":["ev_dddddddddddddddddddddddddddddddddddddddddddddddddddddddddddddddd"],"acceptanceCriterionRefs":["ac_bbbbbbbbbbbbbbbbbbbbbbbbbbbbbbbbbbbbbbbbbbbbbbbbbbbbbbbbbbbbbbbb"],"mandatoryConstraintRefs":["constraint_aaaaaaaaaaaaaaaaaaaaaaaaaaaaaaaaaaaaaaaaaaaaaaaaaaaaaaaaaaaaaaaa"],"decisionRefs":["decision_aaaaaaaaaaaaaaaaaaaaaaaaaaaaaaaaaaaaaaaaaaaaaaaaaaaaaaaaaaaaaaaa"],"storyCausality":"unknown","suggestedOwner":"Product Owner"},
    {"id":"finding_eeeeeeeeeeeeeeeeeeeeeeeeeeeeeeeeeeeeeeeeeeeeeeeeeeeeeeeeeeeeeeee","findingKind":"ambiguity","summary":"Best-effort and durable delivery remain alternatives; discovery does not combine them into work.","evidenceRefs":["ev_eeeeeeeeeeeeeeeeeeeeeeeeeeeeeeeeeeeeeeeeeeeeeeeeeeeeeeeeeeeeeeee"],"acceptanceCriterionRefs":["ac_aaaaaaaaaaaaaaaaaaaaaaaaaaaaaaaaaaaaaaaaaaaaaaaaaaaaaaaaaaaaaaaa"],"mandatoryConstraintRefs":[],"decisionRefs":["decision_bbbbbbbbbbbbbbbbbbbbbbbbbbbbbbbbbbbbbbbbbbbbbbbbbbbbbbbbbbbbbbbb"],"storyCausality":"unknown","suggestedOwner":"Architect"},
    {"id":"finding_ffffffffffffffffffffffffffffffffffffffffffffffffffffffffffffffff","findingKind":"readiness","summary":"Pending business approval is readiness evidence with a Product Owner, not developer effort.","evidenceRefs":["ev_ffffffffffffffffffffffffffffffffffffffffffffffffffffffffffffffff"],"acceptanceCriterionRefs":["ac_cccccccccccccccccccccccccccccccccccccccccccccccccccccccccccccccc"],"mandatoryConstraintRefs":[],"decisionRefs":[],"storyCausality":"unknown","suggestedOwner":"Product Owner"},
    {"id":"finding_0000000000000000000000000000000000000000000000000000000000000000","findingKind":"ambiguity","summary":"Null-semantics ambiguity is recorded without choosing true or false.","evidenceRefs":["ev_0000000000000000000000000000000000000000000000000000000000000000"],"acceptanceCriterionRefs":[],"mandatoryConstraintRefs":[],"decisionRefs":["decision_cccccccccccccccccccccccccccccccccccccccccccccccccccccccccccccccc"],"storyCausality":"pre_existing_independent","suggestedOwner":"Domain Owner"},
    {"id":"finding_1111111111111111111111111111111111111111111111111111111111111111","findingKind":"repository_constraint","summary":"The authorization boundary is a repository constraint, not an implementation instruction.","evidenceRefs":["ev_1111111111111111111111111111111111111111111111111111111111111111"],"acceptanceCriterionRefs":["ac_bbbbbbbbbbbbbbbbbbbbbbbbbbbbbbbbbbbbbbbbbbbbbbbbbbbbbbbbbbbbbbbb"],"mandatoryConstraintRefs":["constraint_aaaaaaaaaaaaaaaaaaaaaaaaaaaaaaaaaaaaaaaaaaaaaaaaaaaaaaaaaaaaaaaa"],"decisionRefs":[],"storyCausality":"unknown","suggestedOwner":"security-owner"}
  ],
  "decisions": [
    {"id":"decision_aaaaaaaaaaaaaaaaaaaaaaaaaaaaaaaaaaaaaaaaaaaaaaaaaaaaaaaaaaaaaaaa","question":"Must direct and federated users resolve to the same synthetic account identity for AC-02?","owner":"Product Owner","status":"open","materiality":"material","options":[{"id":"option_aaaaaaaaaaaaaaaaaaaaaaaaaaaaaaaaaaaaaaaaaaaaaaaaaaaaaaaaaaaaaaaa","label":"Direct subject","summary":"Keep the direct subject identifier."},{"id":"option_bbbbbbbbbbbbbbbbbbbbbbbbbbbbbbbbbbbbbbbbbbbbbbbbbbbbbbbbbbbbbbbb","label":"Canonical account","summary":"Resolve both sign-in paths to a canonical account."}],"selectedOptionId":null,"evidenceRefs":["ev_dddddddddddddddddddddddddddddddddddddddddddddddddddddddddddddddd"]},